{
  "id": "2c585cdd-1821-4bc8-a52b-612b0d53a3aa",
  "kind": "note_editing",
  "created_at": "2026-09-13T19:45:00Z",
  "expires_at": "2026-09-14T19:45:00Z",
  "actor_display_name": "Partner",
  "emoji": null,
  "phrase_key": null,
  "note_id": "33b33f19-10aa-4d6a-948c-698738d9f9ef",
  "note_title": "Weekend ideas"
}
